<?xml version="1.0" encoding="UTF-8"?>
<!-- 
    Openbravo POS is a point of sales application designed for touch screens.
    Copyright (C) 2008-2009 Openbravo, S.L.
    http://sourceforge.net/projects/openbravopos

    This file is part of Openbravo POS.

    Openbravo POS is free software: you can redistribute it and/or modify
    it under the terms of the GNU General Public License as published by
    the Free Software Foundation, either version 3 of the License, or
    (at your option) any later version.

    Openbravo POS is distributed in the hope that it will be useful,
    but WITHOUT ANY WARRANTY; without even the implied warranty of
    MERCHANTABILITY or FITNESS FOR A PARTICULAR PURPOSE.  See the
    GNU General Public License for more details.

    You should have received a copy of the GNU General Public License
    along with Openbravo POS.  If not, see <http://www.gnu.org/licenses/>.
 -->
<configuration xmlns:xsi='http://www.w3.org/2001/XMLSchema-instance'
   xsi:noNamespaceSchemaLocation="Schema.Ticket.xsd">
       
    <button key="button.print" titlekey="button.print" template="/com/nordpos/templates/Printer.TicketPreview.xml"/>
    <button key="button.opendrawer" titlekey="button.opendrawer" template="/com/nordpos/templates/Printer.OpenDrawer.xml"/>

<!-- 
    <event key="ticket.change" code="event.change"/>
    <event key="ticket.addline" code="event.addline"/>
    <event key="ticket.removeline" code="event.removeline"/>
    <event key="ticket.setline" code="event.setline"/>
    <event key="ticket.show" code="event.show"/>
    <event key="ticket.total" code="event.total"/>
    <event key="ticket.close" code="event.close"/>
-->

<!--  
    <event key="ticket.addline" code="Script.StockCurrentAdd"/>
    <event key="ticket.setline" code="Script.StockCurrentSet"/>
-->

    <img-width value="96"/>
    <img-height value="96"/>
    <font-size value="12"/>
    <catvisible value="true" />  
    <cat-height value="256" />
    <pricevisible value="true" />
    
    <taxesincluded value="true"/>   
    
    <attributesautoset value="true"/>
    
    <printselected value="true"/>
    <refmultcontrol value="true" />
    
    <discount-rate-visible value="true"/>
    <discount-rate-1 value="5"/>
    <discount-rate-2 value="10"/>
    <discount-rate-3 value="15"/>

<!--
    <discount-money-visible value="true"/>
    <discount-money-1 value="1"/>
    <discount-money-2 value="5"/>
    <discount-money-3 value="10"/>   
-->
    
<!--    <price-is-zero value="true"/> -->
</configuration>
